{
  "$schema": "http://json-schema.org/draft-07/schema#",
  "title": "Marketplace",
  "type": "object",
  "required": ["name", "owner", "plugins"],
  "properties": {
    "name":  { "type": "string", "minLength": 1 },
    "owner": {
      "type": "object",
      "required": ["name"],
      "properties": { "name": { "type": "string", "minLength": 1 } },
      "additionalProperties": false
    },
    "metadata": {
      "type": "object",
      "properties": { "description": { "type": "string", "minLength": 1 } },
      "additionalProperties": false
    },
    "plugins": {
      "type": "array",
      "minItems": 1,
      "items": {
        "type": "object",
        "required": ["name", "source", "description"],
        "properties": {
          "name":        { "type": "string", "minLength": 1 },
          "source":      { "type": "string", "minLength": 1 },
          "description": { "type": "string", "minLength": 1 }
        },
        "additionalProperties": false
      }
    }
  },
  "additionalProperties": false
}
